{
  "format": "ielts-semantic-breakdown",
  "version": 1,
  "document": {
    "id": "sop-corp-duyet-chi",
    "title": "Quy chế kiểm soát hạn mức duyệt chi và tạm ứng tài chính",
    "text": "Quy chế quản lý tài chính và phê duyệt ngân sách nội bộ được ban hành nhằm thiết lập cơ chế kiểm soát minh bạch đối với mọi hoạt động chi tiêu của công ty, phòng ngừa rủi ro thất thoát nguồn vốn và tối ưu hóa hiệu quả sử dụng dòng tiền kinh doanh. Mọi đề xuất chi tiêu phát sinh phải được lập kế hoạch trước và được phê duyệt bởi người có thẩm quyền tương ứng với từng hạn mức quy định.\n\nHạn mức duyệt chi của Trưởng phòng chuyên môn tối đa là hai mươi triệu đồng đối với các khoản chi thường xuyên trong kế hoạch quý đã được phân bổ. Đối với các khoản chi ngoài ngân sách hoặc có giá trị từ hai mươi triệu đồng đến hai trăm triệu đồng, thẩm quyền phê duyệt thuộc về Giám đốc khối nghiệp vụ. Các khoản chi trên hai trăm triệu đồng bắt buộc phải có chữ ký của Tổng Giám đốc và ý kiến thẩm định của Trưởng ban Kiểm soát.\n\nNhân viên nhận tiền tạm ứng để thực hiện nhiệm vụ công tác hoặc mua sắm vật tư phải hoàn tất thủ tục thanh quyết toán hoàn ứng trong vòng bảy ngày làm việc kể từ ngày hoàn thành công việc. Chứng từ quyết toán bắt buộc phải là hóa đơn giá trị gia tăng hợp pháp, kèm theo bảng kê chi tiết và biên bản nghiệm thu bàn giao hàng hóa hoặc dịch vụ.\n\nBộ phận Kế toán có quyền từ chối thanh toán đối với các chứng từ không hợp lệ hoặc vượt quá hạn mức đã được cấp phép. Mọi hành vi chia nhỏ gói chi để tránh vượt hạn mức thẩm quyền sẽ bị xử lý kỷ luật nghiêm khắc.",
    "taskType": "onboarding",
    "prompt": "Quy định phân quyền ký duyệt thanh toán, chứng từ thanh toán hợp lệ và quy trình hoàn ứng ngân sách phòng ban.",
    "language": "vi"
  },
  "annotations": [
    {
      "id": "sop-corp-duyet-chi-0",
      "start": 388,
      "end": 534,
      "quote": "Hạn mức duyệt chi của Trưởng phòng chuyên môn tối đa là hai mươi triệu đồng đối với các khoản chi thường xuyên trong kế hoạch quý đã được phân bổ.",
      "kind": "structure",
      "level": "sentence",
      "label": "Hạn mức quản lý",
      "body": "Quy định rõ trần chi tiêu giúp phân cấp ủy quyền linh hoạt mà vẫn duy trì được kỷ luật ngân sách không vượt ngoài tầm kiểm soát.",
      "side": "left"
    },
    {
      "id": "sop-corp-duyet-chi-1",
      "start": 740,
      "end": 818,
      "quote": "phải có chữ ký của Tổng Giám đốc và ý kiến thẩm định của Trưởng ban Kiểm soát.",
      "kind": "structure",
      "level": "sentence",
      "label": "Kiểm soát kép",
      "body": "Cơ chế song trùng chữ ký của người ra quyết định và bộ phận thẩm định độc lập ngăn ngừa các xung đột lợi ích tài chính nghiêm trọng.",
      "side": "right"
    },
    {
      "id": "sop-corp-duyet-chi-2",
      "start": 904,
      "end": 1008,
      "quote": "hoàn tất thủ tục thanh quyết toán hoàn ứng trong vòng bảy ngày làm việc kể từ ngày hoàn thành công việc.",
      "kind": "comment",
      "level": "sentence",
      "label": "Thời hạn hoàn ứng",
      "body": "Thời hạn 7 ngày buộc người tạm ứng phải thu thập hóa đơn chứng từ kịp thời, tránh để đọng vốn hoặc thất lạc tài liệu quyết toán thuế.",
      "side": "left"
    },
    {
      "id": "sop-corp-duyet-chi-3",
      "start": 1281,
      "end": 1375,
      "quote": "Mọi hành vi chia nhỏ gói chi để tránh vượt hạn mức thẩm quyền sẽ bị xử lý kỷ luật nghiêm khắc.",
      "kind": "comment",
      "level": "sentence",
      "label": "Chế tài vi phạm",
      "body": "Hành vi lách trần phê duyệt bằng cách chia nhỏ hóa đơn cần được định danh là vi phạm cố ý để áp dụng hình thức xử lý thích đáng.",
      "side": "right"
    }
  ]
}
