{
  "format": "ielts-semantic-breakdown",
  "version": 1,
  "document": {
    "id": "96a2da3d-a573-492a-b59d-e8c4ac4e102d",
    "title": "Quy chế Chi tiêu & SOP Onboarding",
    "text": "QUY CHẾ CHI TIÊU NỘI BỘ & QUY TRÌNH THANH TOÁN DÀNH CHO NHÂN VIÊN MỚI\n\nI. MỤC ĐÍCH & ĐỐI TƯỢNG ÁP DỤNG\nQuy chế này quy định các nguyên tắc, hạn mức và quy trình thanh quyết toán chi phí công tác, mua sắm thiết bị và tiếp khách áp dụng thống nhất cho toàn bộ nhân sự mới gia nhập công ty.\n\nII. HẠN MỨC PHÊ DUYỆT CHI TIÊU\n1. Chi phí dưới 5.000.000 VNĐ: Do Trưởng bộ phận (Team Lead) trực tiếp phê duyệt qua hệ thống nội bộ.\n2. Chi phí từ 5.000.000 VNĐ đến 20.000.000 VNĐ: Cần sự phê duyệt đồng thuận của Trưởng bộ phận và Giám đốc Tài chính (CFO).\n3. Chi phí trên 20.000.000 VNĐ: Bắt buộc phải có phê duyệt trước bằng văn bản của Tổng Giám đốc (CEO).\n\nIII. QUY TRÌNH TẠM ỨNG VÀ HOÀN ỨNG\nBước 1: Tạo phiếu đề xuất tạm ứng trên cổng ERP trước ngày phát sinh chi phí tối thiểu 03 ngày làm việc.\nBước 2: Sau khi hoàn thành công tác, nhân viên phải tập hợp toàn bộ hóa đơn điện tử hợp lệ (VAT) và gửi hồ sơ hoàn ứng trong vòng 05 ngày làm việc.\nBước 3: Phòng Kế toán đối soát chứng từ và thực hiện chuyển khoản quyết toán vào đợt thanh toán định kỳ thứ Sáu hàng tuần.\n\nIV. LƯU Ý QUAN TRỌNG VỀ CHỨNG TỪ HỢP LỆ\nTất cả hóa đơn tài chính phải xuất đúng tên công ty, mã số thuế và địa chỉ đăng ký kinh doanh. Hóa đơn bán lẻ hoặc biên lai không có mã số thuế chỉ được chấp nhận đối với các khoản chi dưới 200.000 VNĐ trong trường hợp bất khả kháng.\n",
    "taskType": "onboarding",
    "prompt": "HƯỚNG DẪN ONBOARDING VỀ QUY CHẾ CHI TIÊU VÀ SOP THANH TOÁN NỘI BỘ\n\nMục tiêu dành cho nhân sự mới:\n1. Nắm rõ hạn mức thẩm quyền phê duyệt để không vượt cấp (Lead vs CFO vs CEO).\n2. Nắm vững trình tự 3 bước từ tạm ứng, lưu trữ hóa đơn VAT đến quyết toán hoàn ứng.\n3. Nhận diện các lỗi sai chứng từ phổ biến khiến kế toán từ chối giải ngân.\n4. Gợi ý: Sử dụng Pass Passage By! kết hợp quay video Loom giải thích từng bước cho nhân viên mới.\n"
  },
  "annotations": [
    {
      "quote": "1. Chi phí dưới 5.000.000 VNĐ: Do Trưởng bộ phận (Team Lead) trực tiếp phê duyệt qua hệ thống nội bộ.",
      "label": "Hạn mức cấp 1 · Team Lead",
      "body": "Khoản chi dưới 5 triệu chỉ cần Team Lead duyệt. Bạn có thể gửi link đề xuất trên Slack cho Lead kèm lý do chi tiết.",
      "kind": "structure",
      "level": "sentence",
      "side": "right",
      "tag": "blue",
      "id": "cd50bd31-d1c8-46f9-b51c-c0c7bf45a629",
      "start": 320,
      "end": 421
    },
    {
      "quote": "3. Chi phí trên 20.000.000 VNĐ: Bắt buộc phải có phê duyệt trước bằng văn bản của Tổng Giám đốc (CEO).",
      "label": "Hạn mức đặc biệt · CEO Approval",
      "body": "Mọi khoản chi lớn trên 20 triệu phải trình CEO phê duyệt trước khi cam kết với nhà cung cấp. Tuyệt đối không chi trước rồi xin hợp thức hóa sau.",
      "kind": "comment",
      "level": "sentence",
      "side": "left",
      "tag": "purple",
      "id": "03d1ab79-32f3-4a23-a4d3-f61f0ca1925c",
      "start": 546,
      "end": 648
    },
    {
      "quote": "Bước 1: Tạo phiếu đề xuất tạm ứng trên cổng ERP trước ngày phát sinh chi phí tối thiểu 03 ngày làm việc.",
      "label": "Quy trình SOP · Tạm ứng trước 3 ngày",
      "body": "Lưu ý deadline 3 ngày làm việc để kế toán kịp chuẩn bị dòng tiền. Các đề xuất gấp trong ngày sẽ bị trừ điểm đánh giá quy trình.",
      "kind": "comment",
      "level": "sentence",
      "side": "right",
      "tag": "green",
      "id": "0cf3870c-29d4-44f8-89b1-df640f032a14",
      "start": 685,
      "end": 789
    },
    {
      "quote": "gửi hồ sơ hoàn ứng trong vòng 05 ngày làm việc.",
      "label": "Thời hạn nộp chứng từ",
      "body": "Quá hạn 5 ngày mà chưa nộp hóa đơn quyết toán, hệ thống ERP sẽ tự động khóa tài khoản tạo đề xuất mới của nhân viên.",
      "kind": "structure",
      "level": "word",
      "side": "left",
      "tag": "orange",
      "id": "66f1e5ad-0ec2-4175-a677-3f9fd8be2cf5",
      "start": 890,
      "end": 937
    },
    {
      "quote": "Hóa đơn bán lẻ hoặc biên lai không có mã số thuế chỉ được chấp nhận đối với các khoản chi dưới 200.000 VNĐ trong trường hợp bất khả kháng.",
      "label": "Lưu ý chứng từ · Rủi ro thuế",
      "body": "Kế toán chỉ chấp nhận hóa đơn VAT điện tử có mã cơ quan thuế. Các biên lai viết tay trên 200k sẽ bị xuất toán và người chi phải tự chịu trách nhiệm.",
      "kind": "comment",
      "level": "sentence",
      "side": "right",
      "tag": "red",
      "id": "fab90bb2-c90b-4f2f-bb1f-e4b51dcadfbd",
      "start": 1197,
      "end": 1335
    }
  ]
}