{
  "format": "ielts-semantic-breakdown",
  "version": 1,
  "document": {
    "id": "sop-corp-onboarding",
    "title": "Quy trình Onboarding & bàn giao trang thiết bị",
    "text": "Quy trình hội nhập nhân sự mới được thiết kế nhằm mục tiêu đảm bảo nhân viên tiếp nhận đầy đủ công cụ làm việc, thấu hiểu văn hóa doanh nghiệp và nhanh chóng hòa nhập hiệu quả vào các dự án chuyên môn trong tuần làm việc đầu tiên. Bộ phận Nhân sự phối hợp cùng Khối Công nghệ thông tin hoàn thiện việc cấp phát tài khoản nội bộ và bàn giao thiết bị phần cứng trước ngày nhận việc chính thức ít nhất hai mươi bốn giờ.\n\nTrong ngày đầu tiên, nhân viên mới được hướng dẫn hoàn thiện hồ sơ tuyển dụng điện tử, ký cam kết bảo mật thông tin khách hàng và nhận biên bản bàn giao máy tính làm việc có cấu hình chuẩn. Người quản lý trực tiếp chịu trách nhiệm chỉ định một người đồng hành kinh nghiệm để hỗ trợ giải đáp thắc mắc chuyên môn, hướng dẫn các công cụ trao đổi trực tuyến và chia sẻ mục tiêu công việc của nhóm.\n\nSau ba mươi ngày và sáu mươi ngày làm việc, người quản lý tổ chức buổi đánh giá tiến độ định kỳ nhằm rà soát mức độ hoàn thành chỉ tiêu thử việc, lắng nghe phản hồi hai chiều và kịp thời hỗ trợ tháo gỡ các khó khăn phát sinh trong quá trình vận hành.\n\nKết thúc giai đoạn thử việc, căn cứ vào bản tự đánh giá của nhân sự và nhận xét của quản lý bộ phận, Ban Giám đốc sẽ xem xét phê duyệt hợp đồng lao động chính thức. Mọi dữ liệu đánh giá phải được lưu trữ đồng bộ trên cổng quản trị nhân sự nội bộ.",
    "taskType": "onboarding",
    "prompt": "Tài liệu hướng dẫn tiếp nhận nhân sự mới, thiết lập môi trường làm việc và bàn giao quyền truy cập hệ thống.",
    "language": "vi"
  },
  "annotations": [
    {
      "id": "sop-corp-onboarding-0",
      "start": 286,
      "end": 416,
      "quote": "hoàn thiện việc cấp phát tài khoản nội bộ và bàn giao thiết bị phần cứng trước ngày nhận việc chính thức ít nhất hai mươi bốn giờ.",
      "kind": "structure",
      "level": "sentence",
      "label": "Chuẩn bị hạ tầng",
      "body": "Việc chủ động cấp tài khoản và thiết bị từ sớm giúp ứng viên có ấn tượng chuyên nghiệp và sẵn sàng tham gia ngay vào ngày đầu tiên.",
      "side": "left"
    },
    {
      "id": "sop-corp-onboarding-1",
      "start": 505,
      "end": 607,
      "quote": "ký cam kết bảo mật thông tin khách hàng và nhận biên bản bàn giao máy tính làm việc có cấu hình chuẩn.",
      "kind": "comment",
      "level": "sentence",
      "label": "Cam kết bảo mật",
      "body": "Ký cam kết NDA và biên bản tài sản là thủ tục pháp lý bắt buộc nhằm xác định ranh giới trách nhiệm khi tiếp cận mã nguồn hoặc dữ liệu khách hàng.",
      "side": "right"
    },
    {
      "id": "sop-corp-onboarding-2",
      "start": 649,
      "end": 729,
      "quote": "chỉ định một người đồng hành kinh nghiệm để hỗ trợ giải đáp thắc mắc chuyên môn,",
      "kind": "vocabulary",
      "level": "sentence",
      "label": "Người đồng hành",
      "body": "Mô hình người hướng dẫn kèm cặp giúp giảm thiểu bỡ ngỡ về văn hóa doanh nghiệp và rút ngắn một nửa thời gian làm quen quy trình.",
      "side": "left"
    },
    {
      "id": "sop-corp-onboarding-3",
      "start": 871,
      "end": 958,
      "quote": "tổ chức buổi đánh giá tiến độ định kỳ nhằm rà soát mức độ hoàn thành chỉ tiêu thử việc,",
      "kind": "structure",
      "level": "sentence",
      "label": "Đánh giá định kỳ",
      "body": "Phản hồi thường xuyên theo tuần và mốc 30 ngày giúp phát hiện sai lệch mục tiêu sớm thay vì chờ đợi đến ngày cuối cùng của kỳ thử việc.",
      "side": "right"
    }
  ]
}
