{
  "format": "ielts-semantic-breakdown",
  "version": 1,
  "document": {
    "id": "research-neuroscience-memory",
    "title": "Neural Correlates of Working Memory in Decision Making",
    "text": "The neural architecture underpinning human working memory relies on persistent recurrent firing across distributed frontoparietal networks, enabling biological agents to maintain goal-relevant representations across temporal delays. Investigating these transient representations during complex analytical problem-solving illuminates how the human brain buffers abstract linguistic premises before formulating deductive inferences in real time.\n\nFunctional neuroimaging reveals that the dorsolateral prefrontal cortex acts as a central cognitive arbiter, modulating synaptic activity across sensory association areas to protect fragile memory traces from interfering distractors. When subjects evaluate contradictory claims in extended texts, localized blood-oxygen-level-dependent responses in the anterior cingulate cortex surge synchronously, signaling cognitive conflict resolution and error monitoring during difficult inferential transitions.\n\nCrucially, individual variations in prefrontal theta-gamma phase coupling reliably predict performance disparities on reading comprehension and multi-clause syntactic parsing batteries. Disrupted synchrony between frontal executive hubs and temporal language modules correlates strongly with reading fatigue and transient lapses in selective attentional focus during prolonged textual evaluation.\n\nThese empirical neurobiological insights validate pedagogical approaches that limit paragraph density and introduce structured visual breaks. By respecting the biophysical constraints of frontoparietal memory buffers, instructional text architecture can measurably optimize reading comprehension, transforming static documentation into cognitive environments aligned with endogenous neurodynamics.",
    "taskType": "research",
    "prompt": "Investigating prefrontal cortical activation during delayed-response tasks using functional magnetic resonance imaging.",
    "language": "en"
  },
  "annotations": [
    {
      "id": "research-neuroscience-memory-0",
      "start": 0,
      "end": 139,
      "quote": "The neural architecture underpinning human working memory relies on persistent recurrent firing across distributed frontoparietal networks,",
      "kind": "structure",
      "level": "sentence",
      "label": "Cortical networks",
      "body": "Introduces the frontoparietal recurrent circuitry model that maintains temporary goal states during complex mental operations.",
      "side": "left"
    },
    {
      "id": "research-neuroscience-memory-1",
      "start": 482,
      "end": 615,
      "quote": "the dorsolateral prefrontal cortex acts as a central cognitive arbiter, modulating synaptic activity across sensory association areas",
      "kind": "vocabulary",
      "level": "sentence",
      "label": "Executive control",
      "body": "Identifies the dorsolateral prefrontal cortex as the neurological coordinator responsible for top-down sensory filtering during deep reading.",
      "side": "right"
    },
    {
      "id": "research-neuroscience-memory-2",
      "start": 985,
      "end": 1088,
      "quote": "prefrontal theta-gamma phase coupling reliably predict performance disparities on reading comprehension",
      "kind": "comment",
      "level": "sentence",
      "label": "Theta-gamma waves",
      "body": "Oscillatory cross-frequency coupling between theta and gamma rhythms represents the biophysical clocking mechanism of multi-item memory.",
      "side": "left"
    },
    {
      "id": "research-neuroscience-memory-3",
      "start": 1388,
      "end": 1488,
      "quote": "validate pedagogical approaches that limit paragraph density and introduce structured visual breaks.",
      "kind": "structure",
      "level": "sentence",
      "label": "Pedagogical design",
      "body": "Translates basic cognitive neuroscience into concrete typographical guidelines, advocating generous line spacing and short chunking.",
      "side": "right"
    }
  ]
}
