{
  "format": "ielts-semantic-breakdown",
  "version": 1,
  "document": {
    "id": "admin-nd30-quyet-dinh",
    "title": "Quyết định ban hành Quy chế văn thư điện tử",
    "text": "Căn cứ Luật Tổ chức Chính phủ ngày 19 tháng 6 năm 2015; Luật sửa đổi, bổ sung một số điều của Luật Tổ chức Chính phủ và Luật Tổ chức chính quyền địa phương ngày 22 tháng 11 năm 2019; Căn cứ Nghị định số 30/2020/NĐ-CP ngày 05 tháng 3 năm 2020 của Chính phủ về công tác văn thư; Theo đề nghị của Chánh Văn phòng cơ quan, Thủ trưởng đơn vị ban hành Quyết định về việc ban hành Quy chế tiếp nhận, xử lý, phát hành và quản lý văn bản điện tử trong toàn bộ hệ thống hoạt động nội bộ.\n\nQuy chế này quy định chi tiết về nguyên tắc gửi, nhận văn bản điện tử có chữ ký số chuyên dùng, việc tạo lập hồ sơ công việc số trên hệ thống thông tin điều hành, cũng như trách nhiệm bảo quản an toàn thông tin dữ liệu. Mọi văn bản phát hành phải đảm bảo đầy đủ thành phần thể thức bắt buộc: số ký hiệu cơ quan, thẩm quyền ban hành, ngày tháng văn bản và sơ đồ bố trí theo đúng quy chuẩn mẫu văn bản hành chính quy định tại Phụ lục I ban hành kèm theo Nghị định số 30/2020/NĐ-CP.\n\nViệc áp dụng chữ ký số chuyên dùng của tổ chức và cá nhân có thẩm quyền phải được thực hiện thông qua thiết bị mã hóa an toàn, không được phép chia sẻ chứng thư số hoặc bàn giao tài khoản quản trị cho người khác sử dụng. Các phòng chuyên môn có trách nhiệm cập nhật nhật ký lưu chuyển và kiểm soát tính toàn vẹn của hồ sơ điện tử.\n\nQuyết định này có hiệu lực thi hành kể từ ngày ký và thay thế các quy định trước đây trái với quyết định này. Chánh Văn phòng, Trưởng các phòng ban nghiệp vụ và toàn thể cán bộ, công chức, viên chức, người lao động thuộc cơ quan chịu trách nhiệm thi hành Quyết định này.",
    "taskType": "administrative",
    "prompt": "Chuẩn hoá thể thức văn bản hành chính theo Nghị định số 30/2020/NĐ-CP của Chính phủ về công tác văn thư.",
    "language": "vi"
  },
  "annotations": [
    {
      "id": "admin-nd30-quyet-dinh-0",
      "start": 183,
      "end": 276,
      "quote": "Căn cứ Nghị định số 30/2020/NĐ-CP ngày 05 tháng 3 năm 2020 của Chính phủ về công tác văn thư;",
      "kind": "structure",
      "level": "sentence",
      "label": "Căn cứ pháp lý",
      "body": "Phải trích dẫn chính xác số hiệu văn bản, ngày tháng ban hành và cơ quan ban hành theo trật tự hiệu lực pháp lý từ cao xuống thấp.",
      "side": "left"
    },
    {
      "id": "admin-nd30-quyet-dinh-1",
      "start": 834,
      "end": 958,
      "quote": "sơ đồ bố trí theo đúng quy chuẩn mẫu văn bản hành chính quy định tại Phụ lục I ban hành kèm theo Nghị định số 30/2020/NĐ-CP.",
      "kind": "structure",
      "level": "sentence",
      "label": "Thể thức chuẩn",
      "body": "Định dạng phông chữ Times New Roman, cỡ chữ, căn lề và vị trí đặt dấu số hiệu phải tuân thủ nghiêm ngặt theo mẫu quy định tại Phụ lục.",
      "side": "right"
    },
    {
      "id": "admin-nd30-quyet-dinh-2",
      "start": 960,
      "end": 1086,
      "quote": "Việc áp dụng chữ ký số chuyên dùng của tổ chức và cá nhân có thẩm quyền phải được thực hiện thông qua thiết bị mã hóa an toàn,",
      "kind": "comment",
      "level": "sentence",
      "label": "Chữ ký số cơ quan",
      "body": "Chữ ký số có giá trị pháp lý tương đương con dấu ướt truyền thống, đòi hỏi quy trình cấp phát và thu hồi chứng thư số phải được ghi nhận rõ ràng.",
      "side": "left"
    },
    {
      "id": "admin-nd30-quyet-dinh-3",
      "start": 1292,
      "end": 1401,
      "quote": "Quyết định này có hiệu lực thi hành kể từ ngày ký và thay thế các quy định trước đây trái với quyết định này.",
      "kind": "structure",
      "level": "sentence",
      "label": "Hiệu lực thi hành",
      "body": "Mốc thời gian có hiệu lực phải được quy định tường minh để làm căn cứ giải quyết chuyển tiếp và bãi bỏ các văn bản cũ không còn phù hợp.",
      "side": "right"
    }
  ]
}
