{
  "format": "ielts-semantic-breakdown",
  "version": 1,
  "document": {
    "id": "research-cognitive-load",
    "title": "Cognitive Load Theory and Multimodal Interface Design",
    "text": "Cognitive Load Theory postulates that human working memory capacity is strictly constrained by finite processing bottlenecks, handling only a restricted number of discrete novel information elements simultaneously. In educational software and specialized reading environments, interface friction frequently imposes severe extraneous cognitive load that detracts directly from schema acquisition and substantive comprehension during demanding close-reading sessions.\n\nThe split-attention effect emerges when learners must mentally integrate disparate sources of information that are physically separated in the visual visual field, such as cross-referencing marginal commentary with paragraph sentences across separate interface windows. Eye-tracking experiments demonstrate that prolonged saccadic travel between body copy and distant annotation drawers significantly elevates pupil dilation metrics, signaling elevated mental exertion without accompanying comprehension gains.\n\nConversely, physically embedding annotations directly adjacent to their contextual anchors—or employing subtle dynamic connectors—reduces search time and mitigates extraneous visual parsing costs. When visual clutter is suppressed and textual hierarchy is reinforced through predictable typography, learners allocate greater germane resources toward deep conceptual synthesis and long-term memory encoding.\n\nOur empirical evaluation across one hundred and forty participants revealed that spatially integrated margin cards improved factual recall by twenty-two percent compared to traditional tabbed inspectors. Interface designers must treat reader attention as an exhaustible physiological resource, engineering visual surfaces that guide cognition without imposing needless navigational friction or disruptive pop-up animations.",
    "taskType": "research",
    "prompt": "Analyzing extraneous cognitive load in complex split-attention interfaces during reading tasks.",
    "language": "en"
  },
  "annotations": [
    {
      "id": "research-cognitive-load-0",
      "start": 277,
      "end": 424,
      "quote": "interface friction frequently imposes severe extraneous cognitive load that detracts directly from schema acquisition and substantive comprehension",
      "kind": "structure",
      "level": "sentence",
      "label": "Extraneous load",
      "body": "Articulates Sweller's cognitive architecture theory, highlighting how awkward UI mechanics unnecessarily consume scarce working memory capacity.",
      "side": "left"
    },
    {
      "id": "research-cognitive-load-1",
      "start": 467,
      "end": 630,
      "quote": "The split-attention effect emerges when learners must mentally integrate disparate sources of information that are physically separated in the visual visual field,",
      "kind": "vocabulary",
      "level": "sentence",
      "label": "Split attention",
      "body": "Defines the canonical split-attention phenomenon where physical distance between reference text and margin notes creates cognitive friction.",
      "side": "right"
    },
    {
      "id": "research-cognitive-load-2",
      "start": 991,
      "end": 1128,
      "quote": "physically embedding annotations directly adjacent to their contextual anchors—or employing subtle dynamic connectors—reduces search time",
      "kind": "comment",
      "level": "sentence",
      "label": "Connector design",
      "body": "Validates the direct visual connector pattern used in modern reading studios, linking margin thoughts directly to their sentence anchors.",
      "side": "left"
    },
    {
      "id": "research-cognitive-load-3",
      "start": 1468,
      "end": 1590,
      "quote": "spatially integrated margin cards improved factual recall by twenty-two percent compared to traditional tabbed inspectors.",
      "kind": "structure",
      "level": "sentence",
      "label": "Empirical gain",
      "body": "Provides quantitative backing from user trials demonstrating that in-situ annotation cards measurably enhance long-term reading retention.",
      "side": "right"
    }
  ]
}
