{
  "format": "ielts-semantic-breakdown",
  "version": 1,
  "document": {
    "id": "admin-nd30-to-trinh",
    "title": "Tờ trình phê duyệt Đề án chuyển đổi số công tác văn thư",
    "text": "Kính gửi Ban Lãnh đạo cơ quan: Thực hiện chỉ đạo về việc đẩy mạnh hiện đại hóa nền hành chính và nâng cao năng suất xử lý công việc, Văn phòng kính trình Ban Lãnh đạo xem xét, phê duyệt Đề án Chuyển đổi số toàn diện công tác văn thư, lưu trữ và luân chuyển tài liệu điện tử giai đoạn 2026-2030. Hiện nay, khối lượng văn bản tiếp nhận và phát hành trung bình vượt quá ba mươi nghìn lượt mỗi năm, trong khi quy trình thủ công bộc lộ nhiều điểm nghẽn về tốc độ tra cứu và chi phí in ấn bảo quản.\n\nĐề án đề xuất triển khai cổng tiếp nhận một cửa số hóa toàn trình, trang bị hạ tầng lưu trữ đám mây chuẩn cấp độ an toàn thông tin loại ba, đồng thời tích hợp chữ ký số cá nhân cho một trăm phần trăm cán bộ thụ lý hồ sơ. Hệ thống sẽ áp dụng chuẩn trích xuất siêu dữ liệu mở theo đúng danh mục trường tin quy định tại Thông tư hướng dẫn của Bộ Nội vụ.\n\nTổng mức đầu tư dự kiến được phân bổ hợp lý theo từng phân kỳ hàng năm, ưu tiên đào tạo bồi dưỡng kỹ năng số cho đội ngũ văn thư viên và xây dựng kho lưu trữ tài liệu lịch sử số hóa dự phòng. Sau khi đề án được phê duyệt, Văn phòng sẽ lập kế hoạch đấu thầu và thành lập Tổ công tác triển khai.\n\nKính trình Ban Lãnh đạo xem xét, phê duyệt chủ trương để tổ chức thực hiện các bước tiếp theo đúng trình tự pháp luật hiện hành.",
    "taskType": "administrative",
    "prompt": "Soạn thảo Tờ trình đề xuất phê duyệt chủ trương triển khai phần mềm quản lý hồ sơ và ký số theo Nghị định 30/2020/NĐ-CP.",
    "language": "vi"
  },
  "annotations": [
    {
      "id": "admin-nd30-to-trinh-0",
      "start": 133,
      "end": 294,
      "quote": "Văn phòng kính trình Ban Lãnh đạo xem xét, phê duyệt Đề án Chuyển đổi số toàn diện công tác văn thư, lưu trữ và luân chuyển tài liệu điện tử giai đoạn 2026-2030.",
      "kind": "structure",
      "level": "sentence",
      "label": "Nội dung tờ trình",
      "body": "Phần mở đầu tờ trình phải nêu bật tên đề án, mục đích xin phê duyệt và phạm vi thời gian triển khai một cách súc tích và trang trọng.",
      "side": "left"
    },
    {
      "id": "admin-nd30-to-trinh-1",
      "start": 405,
      "end": 492,
      "quote": "quy trình thủ công bộc lộ nhiều điểm nghẽn về tốc độ tra cứu và chi phí in ấn bảo quản.",
      "kind": "comment",
      "level": "sentence",
      "label": "Căn cứ thực tiễn",
      "body": "Cần cung cấp số liệu định lượng về chi phí giấy mực, diện tích kho lưu trữ và thời gian tra cứu trung bình để tăng tính thuyết phục của tờ trình.",
      "side": "right"
    },
    {
      "id": "admin-nd30-to-trinh-2",
      "start": 727,
      "end": 844,
      "quote": "áp dụng chuẩn trích xuất siêu dữ liệu mở theo đúng danh mục trường tin quy định tại Thông tư hướng dẫn của Bộ Nội vụ.",
      "kind": "structure",
      "level": "sentence",
      "label": "Quy chuẩn dữ liệu",
      "body": "Dữ liệu văn bản số phải có siêu dữ liệu đồng bộ theo chuẩn quốc gia để đảm bảo khả năng kết nối liên thông với các cơ quan cấp trên.",
      "side": "left"
    },
    {
      "id": "admin-nd30-to-trinh-3",
      "start": 1141,
      "end": 1269,
      "quote": "Kính trình Ban Lãnh đạo xem xét, phê duyệt chủ trương để tổ chức thực hiện các bước tiếp theo đúng trình tự pháp luật hiện hành.",
      "kind": "structure",
      "level": "sentence",
      "label": "Kiến nghị phê duyệt",
      "body": "Đoạn kết tờ trình phải dùng mẫu câu chuẩn mực đề nghị phê duyệt chủ trương hoặc dự toán kinh phí để lãnh đạo có cơ sở ra quyết định.",
      "side": "right"
    }
  ]
}
