{
  "format": "ielts-semantic-breakdown",
  "version": 1,
  "document": {
    "id": "sop-corp-cong-tac-phi",
    "title": "Quy định chế độ thanh toán công tác phí và lưu trú nhân sự",
    "text": "Quy định chế độ công tác phí được áp dụng cho toàn thể cán bộ, nhân viên được cử đi thực hiện nhiệm vụ chuyên môn ngoài phạm vi địa bàn làm việc thường xuyên của doanh nghiệp. Mục đích của quy định là bảo đảm quyền lợi thỏa đáng cho nhân sự khi xa nhà, đồng thời chuẩn hóa định mức chi tiêu hợp lý, tiết kiệm và dễ dàng quyết toán theo luật thuế.\n\nTiêu chuẩn lưu trú khách sạn được phân bổ theo cấp bậc và địa bàn công tác: mức khoán phòng tại các thành phố trực thuộc Trung ương như Hà Nội, Đà Nẵng và Thành phố Hồ Chí Minh là một triệu hai trăm nghìn đồng mỗi đêm đối với chuyên viên, và một triệu tám trăm nghìn đồng đối với cấp quản lý. Nhân viên di chuyển bằng phương tiện máy bay được áp dụng vé hạng phổ thông đối với các chặng bay có thời gian bay trên hai giờ.\n\nTrong thời gian công tác, phụ cấp lưu trú hàng ngày được chi trả để hỗ trợ tiền ăn uống và chi phí sinh hoạt nhỏ lẻ với mức ba trăm nghìn đồng mỗi ngày. Toàn bộ chi phí vận chuyển công vụ nội thành phải có hóa đơn cước xe taxi công nghệ hoặc vé phương tiện giao thông công cộng hợp lệ đi kèm.\n\nTrong thời hạn năm ngày làm việc kể từ ngày kết thúc chuyến đi, nhân viên có trách nhiệm nộp giấy đi đường có xác nhận của đơn vị đến công tác và toàn bộ hóa đơn điện tử hợp lệ về Phòng Tài chính Kế toán để hoàn tất thủ tục quyết toán.",
    "taskType": "onboarding",
    "prompt": "Tiêu chuẩn định mức phụ cấp công tác, phương tiện di chuyển và thủ tục quyết toán chi phí cho cán bộ nhân viên.",
    "language": "vi"
  },
  "annotations": [
    {
      "id": "sop-corp-cong-tac-phi-0",
      "start": 424,
      "end": 586,
      "quote": "mức khoán phòng tại các thành phố trực thuộc Trung ương như Hà Nội, Đà Nẵng và Thành phố Hồ Chí Minh là một triệu hai trăm nghìn đồng mỗi đêm đối với chuyên viên,",
      "kind": "structure",
      "level": "sentence",
      "label": "Định mức lưu trú",
      "body": "Quy định khung định mức cụ thể theo địa phương giúp nhân viên chủ động lựa chọn địa điểm lưu trú phù hợp mà không lo bị xuất toán.",
      "side": "left"
    },
    {
      "id": "sop-corp-cong-tac-phi-1",
      "start": 641,
      "end": 769,
      "quote": "Nhân viên di chuyển bằng phương tiện máy bay được áp dụng vé hạng phổ thông đối với các chặng bay có thời gian bay trên hai giờ.",
      "kind": "structure",
      "level": "sentence",
      "label": "Vé máy bay công vụ",
      "body": "Áp dụng vé hạng phổ thông tiêu chuẩn giúp tối ưu chi phí vận hành doanh nghiệp mà vẫn đáp ứng nhu cầu di chuyển nhanh cho nhân viên.",
      "side": "right"
    },
    {
      "id": "sop-corp-cong-tac-phi-2",
      "start": 797,
      "end": 923,
      "quote": "phụ cấp lưu trú hàng ngày được chi trả để hỗ trợ tiền ăn uống và chi phí sinh hoạt nhỏ lẻ với mức ba trăm nghìn đồng mỗi ngày.",
      "kind": "comment",
      "level": "sentence",
      "label": "Phụ cấp đi đường",
      "body": "Mức phụ cấp ăn uống khoán ngày giúp đơn giản hóa việc lưu giữ các hóa đơn ăn uống lặt vặt cho cả nhân viên lẫn bộ phận kế toán.",
      "side": "left"
    },
    {
      "id": "sop-corp-cong-tac-phi-3",
      "start": 1154,
      "end": 1268,
      "quote": "nộp giấy đi đường có xác nhận của đơn vị đến công tác và toàn bộ hóa đơn điện tử hợp lệ về Phòng Tài chính Kế toán",
      "kind": "structure",
      "level": "sentence",
      "label": "Hồ sơ quyết toán",
      "body": "Giấy đi đường có xác nhận của đối tác là bằng chứng pháp lý quan trọng nhất để cơ quan thuế chấp nhận chi phí công tác hợp lệ.",
      "side": "right"
    }
  ]
}
