{
  "format": "ielts-semantic-breakdown",
  "version": 1,
  "document": {
    "id": "discursive-science-communication",
    "title": "The Rhetoric of Public Science Communication in Epidemics",
    "text": "During acute epidemiological crises, scientific institutions and public health agencies are tasked with communicating complex, rapidly evolving empirical findings to a fearful and polarized public. The prevailing communicative instinct has historically favored authoritative declarations that project unwavering certainty. However, rhetorical analysis suggests that concealing epistemic uncertainty to maintain public compliance ultimately erodes the very institutional trust required for sustained collective action. When scientific leaders present provisional hypotheses as settled dogma, any subsequent revision invites intense public cynicism.\n\nWhen emerging viral variants or transmission mechanisms inevitably challenge preliminary official guidance, public health authorities that previously claimed absolute confidence face severe reputational backlash. Skeptical audiences interpret revised recommendations not as the natural progression of iterative scientific discovery, but as evidence of incompetence or deliberate deception. Transparent communication that explicitly acknowledges the boundaries of current empirical knowledge fosters greater long-term resilience across civil society, treating citizens as rational partners rather than passive recipients of paternalistic instructions.\n\nFurthermore, effective public health messaging must balance objective statistical risk assessments with empathetic communal narratives. Abstract probabilities such as viral transmission coefficients fail to motivate behavioral changes unless translated into relatable, collective civic duties that protect vulnerable neighbors and preserve community healthcare capacity. Clear visual dashboards and unambiguous guidance empower communities to take coordinated protective actions without succumbing to fatalistic fatigue or paralyzing panic.\n\nIn conclusion, institutional credibility rests upon intellectual humility rather than dogmatic certainty. Communicators who honestly articulate ongoing scientific uncertainties while providing actionable precautions cultivate mature public trust that withstands the trials of unfolding global crises, building lasting social capital for future public emergencies.",
    "taskType": "discursive",
    "prompt": "Examining persuasive rhetoric, epistemic uncertainty, and institutional trust during public health crises.",
    "language": "en"
  },
  "annotations": [
    {
      "id": "discursive-science-communication-0",
      "start": 366,
      "end": 517,
      "quote": "concealing epistemic uncertainty to maintain public compliance ultimately erodes the very institutional trust required for sustained collective action.",
      "kind": "structure",
      "level": "sentence",
      "label": "Epistemic trust",
      "body": "Critiques institutional paternalism, showing that suppressing scientific uncertainty backfires when empirical facts shift.",
      "side": "left"
    },
    {
      "id": "discursive-science-communication-1",
      "start": 862,
      "end": 1038,
      "quote": "Skeptical audiences interpret revised recommendations not as the natural progression of iterative scientific discovery, but as evidence of incompetence or deliberate deception.",
      "kind": "comment",
      "level": "sentence",
      "label": "Public skepticism",
      "body": "Analyzes the communicative breakdown where routine scientific updates are misconstrued as deceit due to prior overconfidence.",
      "side": "right"
    },
    {
      "id": "discursive-science-communication-2",
      "start": 1353,
      "end": 1436,
      "quote": "balance objective statistical risk assessments with empathetic communal narratives.",
      "kind": "vocabulary",
      "level": "sentence",
      "label": "Risk narrative",
      "body": "Advocates blending quantitative epidemiological data with civic narrative frames that inspire collective moral responsibility.",
      "side": "left"
    },
    {
      "id": "discursive-science-communication-3",
      "start": 1858,
      "end": 1948,
      "quote": "institutional credibility rests upon intellectual humility rather than dogmatic certainty.",
      "kind": "structure",
      "level": "sentence",
      "label": "Scientific modesty",
      "body": "Concludes that genuine institutional authority stems from candid humility and transparent updates rather than rigid dogma.",
      "side": "right"
    }
  ]
}
