{
  "format": "ielts-semantic-breakdown",
  "version": 1,
  "document": {
    "id": "admin-nd30-ke-hoach",
    "title": "Kế hoạch ứng phó & khắc phục sự cố an toàn thông tin",
    "text": "Thực hiện định hướng bảo đảm an toàn thông tin mạng quốc gia và các quy định của Chính phủ về bảo vệ bí mật nhà nước trên không gian mạng, cơ quan ban hành Kế hoạch phòng ngừa, ứng phó và khắc phục sự cố an toàn thông tin hệ thống quản lý văn bản điều hành năm 2026. Kế hoạch nhằm chủ động phòng ngừa các nguy cơ tấn công mạng, bảo đảm tính sẵn sàng, bảo mật và toàn vẹn của kho tài liệu số hóa.\n\nNội dung kế hoạch tập trung vào ba giải pháp trọng tâm: Thứ nhất, định kỳ hàng tuần thực hiện quét lỗ hổng bảo mật và kiểm tra mã độc trên toàn bộ máy chủ cơ sở dữ liệu. Thứ hai, duy trì cơ chế sao lưu dữ liệu tự động hàng ngày theo mô hình ba hai một, trong đó một bản lưu ngoại tuyến được bảo quản tại địa điểm dự phòng thảm họa độc lập. Thứ ba, tổ chức diễn tập thực chiến tình huống rò rỉ dữ liệu và khôi phục hệ thống trong vòng sáu giờ kể từ khi phát hiện cảnh báo.\n\nKinh phí thực hiện kế hoạch được bố trí từ nguồn kinh phí sự nghiệp công nghệ thông tin đã được phê duyệt trong dự toán ngân sách đầu năm. Phòng Công nghệ thông tin chủ trì phối hợp với các đơn vị liên quan tổ chức thực hiện và báo cáo kết quả lên Ban Chỉ đạo an toàn thông tin cơ quan.\n\nYêu cầu Thủ trưởng các đơn vị quán triệt nghiêm túc kế hoạch này đến toàn thể cán bộ công chức thuộc thẩm quyền quản lý để bảo đảm sự đồng bộ trong toàn cơ quan.",
    "taskType": "administrative",
    "prompt": "Xây dựng kế hoạch bảo đảm an toàn hệ thống lưu trữ tài liệu số hóa theo quy định bảo mật hồ sơ cơ quan nhà nước.",
    "language": "vi"
  },
  "annotations": [
    {
      "id": "admin-nd30-ke-hoach-0",
      "start": 267,
      "end": 395,
      "quote": "Kế hoạch nhằm chủ động phòng ngừa các nguy cơ tấn công mạng, bảo đảm tính sẵn sàng, bảo mật và toàn vẹn của kho tài liệu số hóa.",
      "kind": "structure",
      "level": "sentence",
      "label": "Mục đích kế hoạch",
      "body": "Khẳng định mục tiêu bảo vệ bộ ba tính chất cốt lõi của an toàn thông tin: tính bảo mật, tính toàn vẹn và tính sẵn sàng của hồ sơ điện tử.",
      "side": "left"
    },
    {
      "id": "admin-nd30-ke-hoach-1",
      "start": 576,
      "end": 736,
      "quote": "duy trì cơ chế sao lưu dữ liệu tự động hàng ngày theo mô hình ba hai một, trong đó một bản lưu ngoại tuyến được bảo quản tại địa điểm dự phòng thảm họa độc lập.",
      "kind": "structure",
      "level": "sentence",
      "label": "Mô hình sao lưu",
      "body": "Chiến lược sao lưu 3-2-1 là tiêu chuẩn phòng thủ dữ liệu hàng đầu, ngăn ngừa nguy cơ mất trắng dữ liệu khi xảy ra mã độc tống tiền.",
      "side": "right"
    },
    {
      "id": "admin-nd30-ke-hoach-2",
      "start": 745,
      "end": 868,
      "quote": "tổ chức diễn tập thực chiến tình huống rò rỉ dữ liệu và khôi phục hệ thống trong vòng sáu giờ kể từ khi phát hiện cảnh báo.",
      "kind": "comment",
      "level": "sentence",
      "label": "Chỉ số RTO",
      "body": "Xác lập thời gian khôi phục mục tiêu RTO 6 giờ giúp đội ngũ kỹ thuật có thước đo rõ ràng trong các đợt kiểm tra diễn tập thực tế.",
      "side": "left"
    },
    {
      "id": "admin-nd30-ke-hoach-3",
      "start": 1188,
      "end": 1277,
      "quote": "quán triệt nghiêm túc kế hoạch này đến toàn thể cán bộ công chức thuộc thẩm quyền quản lý",
      "kind": "structure",
      "level": "sentence",
      "label": "Tổ chức thực hiện",
      "body": "Ý thức tuân thủ của từng nhân sự là tuyến phòng thủ quan trọng nhất trong việc ngăn chặn các cuộc tấn công qua email giả mạo.",
      "side": "right"
    }
  ]
}
